{"schema_version":"1.0","scenario_id":"f04-dual-write-divergence-repaired","pair_id":"F04","variant":"repaired","seed":1404,"workload":{"nightly_reads":18000,"nightly_publications":1200,"burst_multiplier":20,"good_reads":538000},"contracts":{"producer_version":2,"consumer_version":2,"required_fields":["observation_id","publication_scope"],"emitted_fields":["observation_id","publication_scope"],"unknown_fields_tolerated":true},"migration":{"phase":"backfill","total_records":8000,"processed_records":8000,"checkpoint":8000,"crash_after_write":false,"source_version":808,"projected_version":808,"old_reader_present":true,"rollback_state_compatible":true},"writes":{"source_of_truth":"registry","registry_value":"approved","catalog_value":"rejected","independent_dual_write":true},"traffic":{"shadow_percent":10,"sample_count":1000,"mismatches":0,"hard_mismatch":false,"promotion_threshold":0.001,"cutover_percent":0},"costs":{"direct":15000,"shared":0,"labor":24000,"transition":12000,"risk":3000,"good_outcomes":538000,"budget_per_1000":105},"dependency":{"name":"platform-event-lane","quota":30000,"required_peak":24000,"price_multiplier":1,"portable_contract":true,"export_ready":true,"fallback_ready":true},"ownership":{"primary":"research-access","secondary_count":2,"runbook_verified":true,"access_verified":true,"handoff_passed":true},"controls":{"backward_compatible_contract":true,"expand_contract_sequencing":true,"resumable_backfill":true,"single_write_authority":true,"shadow_comparison_gate":true,"tested_cutover_rollback":true,"unit_cost_budget":true,"dependency_exit_plan":true,"ownership_continuity":true},"expected":{"target_invariant":"I06","repaired_invariants":["I01","I02","I03","I04","I05","I06","I07","I08","I09","I10","I11","I12"]}}
